Nome Produto,Marca,Descricao do Produto,  De  ,  Por  ,LegalAdesivo para Unhas Nail Art Stickers Lace,Hello Kitty,,29,19,Adesivo Sephora by OPI Trend Tips,OPI for Sephora,,45,38,Apontador de Lápis para Maquiagem Grind House Pencil Sharpener,Urban Decay,,59,49,Case de Maquiagem Hello Kitty Traincase,Hello Kitty,,329,249,Cortador de Unha com Coletor Pink,Tweezerman,,79,59,Escova Boar Detangling Brush,Sephora Collection,,102,79,Espelho Bling Compact Mirror,Hello Kitty,,99,79,Espelho com Luz 10x,Tweezerman,,120,72,Espelho Compact Mirror,Hello Kitty,,99,79,Espelho Head of the Class Compact Mirror,Hello Kitty,,99,79,Espelho Tweezermate 10X Pink,Tweezerman,,100,60,Estojo Custom Compact 6 Well,Laura Mercier,,59,49,Estojo de Maquiagem Color My Life Eye & Lip Makeup Tablet,Sephora Collection,,179,159,Kit 5 Piece Brush Set With Case,Kat Von D,,270,229,Kit de Pincéis Hello Kitty Brushes with Head Toppers,Hello Kitty,,199,129,Lixa de Unha Hello Kitty Nail File,Hello Kitty,,29,19,Lixa Solemate,Tweezerman,,175,105,Lixa Tweezerman,Tweezerman,,20,15,Lixas para unhas,Tweezerman,,25,22,Mini Kit Manicure,Tweezerman,,126,99,Mini Pinça,Tweezerman,,45,29,Mini pinça Cynthia Rowley Designer Series,Tweezerman,,70,59,Mini Pinça Mix N Match Runway Collection,Tweezerman,,85,51,Mini Pinça Slant de Aço Inoxidável Fresh N Fruity,Tweezerman,,55,49,Mini Pinça Slant Zig Zag com Espelho,Tweezerman,,100,89,Pedra para Lixar Calo Pedro,Tweezerman,,89,53,Pedra para Lixar Calo Pedro Pink,Tweezerman,,95,69,Pinça Betsey Johnson Slant Tweezer Collection,Tweezerman,,120,89,Pinça em Cristal Swarovski,Tweezerman,,440,264,Pinça para Sobrancelha em Aço Inoxidável com Ponta Fina,Tweezerman,,85,69,Pinça para Sobrancelha Estampa Bolinha e Cristal,Tweezerman,,160,89,Pinça para Sobrancelha Estampa Onça,Tweezerman,,79,69,Pinça para Sobrancelha Estampa Reptil,Tweezerman,,79,59,Pinça para Sobrancelha Floral,Tweezerman,,85,59,Pinça Pointed Slant Pink com Cristal,Tweezerman,,79,59,Pinça Slant de Coração com Estojo de Couro,Tweezerman,,100,79,Pincel #24 Double-Sided Illuminating Powder Brush,Stila,,229,159,Pincel 24/7 Shadow Pencil Blending Brush,Urban Decay,,79,59,Pincel de delineador #28 Smudge Pot Brush,Stila,,146,99,Pincel Finishing Brush No. 7,Hourglass,,333,199,Pincel Foundation/Blush Brush No. 2,Hourglass,,296,199,Pincel Kabuki Brush,Hello Kitty,,149,99,Pincel Kabuki Face Brush,Laura Mercier,,199,149,Pincel One Step Complexion Brush #33,Stila,,146,99,Pincel para Corretivo Camouflage Powder Brush,Laura Mercier,,139,99,Pincel para os Olhos Flat Eye Liner Brush,Laura Mercier,,129,99,Pincel Pro Airbrush #55,Sephora Collection,,149,99,Pincel Pro Angled Liner #22,Sephora Collection,,76,59,Pincel Pro Blending #27,Sephora Collection,,87,75,Pincel Pro Brow #20,Sephora Collection,,75,65,Pincel Pro Brow Comb #21,Sephora Collection,,75,65,Pincel Pro Kabuki #43,Sephora Collection,,199,159,Pincel Pro Lip #81,Sephora Collection,,68,59,Pincel Pro Precision Blush #73,Sephora Collection,,139,99,Pincel Professionnel Brow Brush #10,Sephora Collection,,47,28,Pincel Professionnel Retractable Travel Powder Brush #51,Sephora Collection,,129,79,Pincel Retractable Foundation Brush,Hourglass,,215,119,Pincel Tattoo Concealer Brush,Kat Von D,,89,69,Recipiente de Viagem Universal Atomizer,Sephora Collection,,125,99,Tesoura para Unhas,Tweezerman,,170,99,Touca Shower Cap,Hello Kitty,,89,49,Brinde 3 Pan Colorful Palette,Sephora Collection,,47,35,Base Coat  CLEANSE - Nail Cleanser,Formula X,,69,59,Base Coat  PRIME - Base Coat,Formula X,,69,59,Base Genius Gel Super - Charged Foundation,Marc Jacobs Beauty,,319,229,Base Hidratante Illusion Tinted Moisturizer Oil Free SPF 15,Hourglass,,280,229,Base Iluminadora Silk Creme Foundation,Laura Mercier,,195,149,cores selecionadasBase Iluminadora Tinted Moisturizer SPF 20 - Illuminating,Laura Mercier,,299,169,Base La Base Pro - Base de Maquillage Perfectrice Effet Peau Lisse,Lancôme,,272,190,Base Light Veil Foundation,Sephora Collection,,83,59,Base Marvelous Mousse Transformative Foundation,Marc Jacobs Beauty,,299,239,Base Matchmaker Serum Foundation,Josie Maran,,209,126,Base Moisture Supreme Foundation,Laura Mercier,,279,169,Base Naked Weightless Ultra Definition Liquid Makeup,Urban Decay,,229,199,Base Oil Free Suprême Foundation,Laura Mercier,,195,139,Base Perfect & Correct Foundation,Stila,,220,129,Base Sheer Color Tinted Moisturizer SPF 20,Stila,,155,129,Base Smooth Finish Flawless Fluide,Laura Mercier,,319,210,Base Stay All Day® Foundation & Concealer,Stila,,220,129,cores selecionadasBase Teint Idole Ultra Compact,Lancôme,,269,188,cores selecionadasBase Tinted Moisturizer Broad Spectrum SPF 20,Laura Mercier,,299,169,cores selecionadasBase Tinted Moisturizer Broad Spectrum SPF 20 - Oil Free,Laura Mercier,,299,169,cores selecionadasBase Tinted Moisturizer Crème Compact Broad Spectrum SPF 20 Sunscreen,Laura Mercier,,299,169,Batom Argan Color Stick,Josie Maran,,99,60,cores selecionadasBatom Argan Love Your Lips Hydrating Lipstick,Josie Maran,,79,48,cores selecionadasBatom Color Balm Lipstick,Stila,,110,69,cores selecionadasBatom Colorburst LipButter,Revlon,,37,23,Batom Crème Smooth Lip Colour,Laura Mercier,,159,99,cores selecionadasBatom e Brilho Long Wear Lip Color,Stila,,100,99,cores selecionadasBatom Femme Rouge Velvet Crème Lipstick,Hourglass,,153,119,cores selecionadasBatom Lip Colour - Sheer,Laura Mercier,,139,79,cores selecionadasBatom Lovemarc Lip Gel,Marc Jacobs Beauty,,169,159,cores selecionadasBatom Magic Marker Lip and Cheek Stain,Josie Maran,,88,53,cores selecionadasBatom Opaque Rouge Liquid Lipstick,Hourglass,,128,99,cores selecionadasBatom Painted Love Lipstick,Kat Von D,,89,69,cores selecionadasBatom Rouge Infusion Lip Stain,Sephora Collection,,62,49,cores selecionadasBatom Stay All Day Liquid Lipstick,Stila,,100,69,cores selecionadasBatom Stickgloss Lip Colour,Laura Mercier,,139,110,cores selecionadasBatom Super-Saturated High Gloss Lip Color,Urban Decay,,93,79,cores selecionadasBB Cream Naked Beauty Balm,Urban Decay,,239,149,BB Cream Stay All Day® 10-In-One HD Beauty Balm With Broad Spectrum SPF 30,Stila,,179,159,Blush Argan Infinity Lip and Cheek Creamy Oil,Josie Maran,,99,60,cores selecionadasBlush Coconut Watercolor Cheek Gelée,Josie Maran,,119,72,cores selecionadasBlush Color Adapt,Sephora Collection,,69,59,Blush Convertible Color,Stila,,118,79,cores selecionadasBlush Everlasting Blush,Kat Von D,,169,99,cores selecionadasBlush Fashion Artist's Edition,Sephora Collection,,89,54,cores selecionadasBlush Second Skin Cheek Colour,Laura Mercier,,169,129,cores selecionadasBlush Shameless Bold Blush,Marc Jacobs Beauty,,199,119,cores selecionadasBrilho Crush Lip and Cheek Stain,Stila,,118,79,cores selecionadasBrilho Extreme Sheen High Shine Lip Gloss,Hourglass,,143,99,cores selecionadasBrilho L´Absolu Velours,Lancôme,,149,104,Brilho Labial Lip Glacé,Laura Mercier,,149,119,cores selecionadasBrilho Labial Lust For Lacquer Lip Vinyl,Marc Jacobs Beauty,,159,110,cores selecionadasBrilho Labial Volume Booster Gloss Serum,Sephora Collection,,72,59,cores selecionadasBrilho Lip Glaze,Stila,,100,79,cores selecionadasBrilho Lip Junkie Lipgloss,Urban Decay,,93,79,cores selecionadasBrilho Naked Lipgloss,Urban Decay,,125,79,Brilho Naked LipglossBrilho Silk Shimmer Gloss,Stila,,100,79,Brilho Ultra Shine Lip Gloss,Sephora Collection,,62,21,cores selecionadasCC Eye Cream Concealer,Sephora Collection,,99,59,Corretivo Argan Creamy Concealer Crayon,Josie Maran,,89,54,cores selecionadasCorretivo Effacernes Longue Tenue Soin Teinté Unifiant Anti-Cernes,Lancôme,,199,139,Corretivo Naked Skin Concealer,Urban Decay,,169,129,Corretivo Perfecting Concealer,Stila,,118,79,cores selecionadasDelineador Calligraphy Liquid Eye Liner,Hourglass,,164,129,COGNACDelineador de Sobrancelhas Stay All Day Waterproof Brow Color,Stila,,109,99,Delineador Kajal Eye Liner,Stila,,89,69,Delineador Long-Lasting Eye Liner,Sephora Collection,,64,49,Delineador Smudge Stick Waterproof Eye Liner,Stila,,109,69,Delineador Sparkle Waterproof Liquid Eye Liner,Stila,,118,89,Delineador Stay All Day Waterproof Liquid Eye Liner,Stila,,109,89,cores selecionadasDelineador Super-Saturated Ultra Intense Cream Eyeliner,Urban Decay,,155,99,Delineador Tightline Cake Eye Liner,Laura Mercier,,149,129,cores selecionadasDemaquilante Instant Eye Makeup Remover,Sephora Collection,,29,19,Duo de Corretivos Secret Camouflage,Laura Mercier,,229,129,Duo To Go - 2 Mini Pinças com Estojo em Glitter + Espelho,Tweezerman,,140,99,Esmalte Color Hit Nail Polish,Sephora Collection,,19,12,cores selecionadasEsmalte Enamored Hi-Shine Nail Lacquer,Marc Jacobs Beauty,,139,79,cores selecionadasEsmalte Liquid Crystals,Formula X,,79,59,cores selecionadasEsmalte Lusters,Formula X,,79,59,Esmalte Nail Color,Formula X,,69,59,cores selecionadasEsmalte Parfumerie,Revlon,,84,18,cores selecionadasEsmalte Shifters,Formula X,,79,59,cores selecionadasEsmalte Translucents,Formula X,,79,59,Esmalte Vernis in Love,Lancôme,,99,69,Estojo de Sombras Infinity Palette with Glittery Eyeshadow,Sephora Collection,,169,149,Estojo de Sombras Style Eye-Con No.7,Marc Jacobs Beauty,,349,199,Estojo de Sombras Vice3,Urban Decay,,299,249,Estojo para Base Illuminating Powder Foundation,Stila,,73,49,Estojo para Sombras Custom Eye Compact,Laura Mercier,,59,49,Estojo Sombras Style Eye-Con No.3,Marc Jacobs Beauty,,229,129,Feminine Palette,Urban Decay,,209,159,Fixador de Maquiagem Chill Make Up Setting Spray,Urban Decay,,137,99,Fixador De-Slick Oil-Control Makeup Setting Spray,Urban Decay,,179,99,Kit Best of Hourglass Set,Hourglass,,275,199,Lápis de Olhos 24/7 Glide-On Eye Pencils,Urban Decay,,115,79,cores selecionadasLápis de Olhos 24/7 Velvet Glide On Eye Pencil,Urban Decay,,115,69,Lápis de Olhos Jumbo Liner 12HR Wear Waterproof,Sephora Collection,,64,49,cores selecionadasLápis de Olhos Jumbo Liner Spring Collection 15,Sephora Collection,,64,55,cores selecionadasLápis de Olhos Kohl Eye Pencil,Laura Mercier,,139,110,Lápis de Olhos Nano Eyeliner,Sephora Collection,,19,12,Lápis de Sobrancelhas Sculpting Brow Pencil,Sephora Collection,,36,14,Lápis Labial 24/7 Glide-On Lip Pencils,Urban Decay,,115,69,Lápis Labial Aura Sheer Lip Stain,Hourglass,,132,99,cores selecionadasLápis Labial Trace Lip Liner,Hourglass,,143,129,Lápis Labial Ultra Vinyl Lip Pencil,Sephora Collection,,50,39,Máscara de Cílios Cannonball Ultra Waterproof,Urban Decay,,106,69,cores selecionadasMáscara de Cílios Film Noir Full Spectrum Mascara,Hourglass,,143,86,Máscara de Cílios Forever Your Curl,Stila,,118,89,Máscara de Cílios Long Lash Mascara,Laura Mercier,,129,115,Máscara de Cílios Scandal Queen Mascara,Fairydrops,,145,135,Máscara de Cilios Stay All Day Waterproof Volumizing Mascara,Stila,,118,89,Máscara Hidratante Masque Recharge Hydration Lumiére,Givenchy,,219,139,Mini It Palette Fashion Artist's Edition,Sephora Collection,,99,75,Óleo Hidratante 100% Pure Argan Oil Light,Josie Maran,,225,135,Palette Ammo,Urban Decay,,175,155,Palette Anarchy Fase Case,Urban Decay,,272,149,Pó Argan Matchmaker Powder Foundation SPF 20,Josie Maran,,189,114,Pó Base Smooth Finish Foundation Powder,Laura Mercier,,319,229,Pó Bronzeador All Over Shimmer Duo,Stila,,100,89,Pó Bronzeador Bronzing Pressed Powder,Laura Mercier,,145,99,cores selecionadasPó Bronzeador Everlasting Bronzer,Kat Von D,,134,99,Pó Bronzeador Illume Creme-To-Powder Bronzer Duo,Hourglass,,204,129,sunsetPó Bronzeador Stila Sun Bronzer,Stila,,118,89,SHADE 02Pó Compacto Lock-It Powder Compact Foundation,Kat Von D,,249,149,cores selecionadasPó Compacto Naked Skin Ultra Definition Pressed Finishing Powder,Urban Decay,,229,150,cores selecionadasPó Compacto Teint Miracle Compact,Lancôme,,269,188,4Pó Finalizador Ambient Lighting Powder,Hourglass,,294,199,cores selecionadasPó Finalizador Razor Sharp Ultra Definition Finishing Powder,Urban Decay,,153,129,Pó Iluminador Shimmer Bloc,Laura Mercier,,269,229,Pó Mineral Powder SPF 15,Laura Mercier,,229,149,cores selecionadasPó Solto Transparente Invisible Loose Setting Powder,Laura Mercier,,229,176,Pó Solto Transparente Loose Setting Powder,Laura Mercier,,229,179,Pó Transparente De-Slick Mattifying Powder,Urban Decay,,159,143,Pó Transparente Pressed Setting Powder,Laura Mercier,,209,99,Pó-base Illuminating Powder Foundation SPF 12,Stila,,146,119,Pó-base Oxygen Foundation Mineral Powder,Hourglass,,235,149,cores selecionadasPré-Maquiagem Eyeshadow Primer Potion,Urban Decay,,135,79,cores selecionadasPré-Maquiagem Foundation Primer - Radiance,Laura Mercier,,199,149,Pré-Maquiagem Nº 28 Primer Serum Hydrating Anti-Aging,Hourglass,,314,229,cores selecionadasPré-Maquiagem Primer Eye Basics,Laura Mercier,,159,129,cores selecionadasSerum Argan Milk Treatment,Josie Maran,,299,180,Set of 5 Color Hit Nail Set,Sephora Collection,,132,79,Sombra Baked Eye Colour,Laura Mercier,,149,89,cores selecionadasSombra Baked Eye Shadow Trio,Stila,,127,99,cores selecionadasSombra Caviar Stick Eye Colour,Laura Mercier,,159,99,cores selecionadasSombra Coconut Watercolor Eye Shadow,Josie Maran,,99,60,cores selecionadasSombra Colorful Mono Eyeshadow,Sephora Collection,,49,35,cores selecionadasSombra Colorful Palette,Sephora Collection,,97,69,cores selecionadasSombra Eye Colour,Laura Mercier,,139,99,cores selecionadasSombra Hypnôse Drama Eyes,Lancôme,,169,118,cores selecionadasSombra Ombre Hypnose,Lancôme,,155,109,cores selecionadasSombra Photoready,Revlon,,89,51,cores selecionadasSombra Sephora Collection Colorful Eyeshadow,Sephora Collection,,49,29,cores selecionadasSombra Stila Eyeshadow,Stila,,91,69,cores selecionadasSombra Stila Eyeshadow Trio,Stila,,100,89,cores selecionadasSombra Stila Jewel Eye Shadow Single,Stila,,100,69,cores selecionadasSombra True Romance Eyeshadow Palette Poetica,Kat Von D,,177,139,cores selecionadasSombra Urban Decay Eyeshadow,Urban Decay,,110,69,cores selecionadasSombra Visionaire Eye Shadow Duo,Hourglass,,196,129,cores selecionadasTop Coat Transformers,Formula X,,79,59,Top Coat Xplosives,Formula X,,79,59,Delineador Colorful Eyeliner,Sephora Collection,,64,45,cores selecionadasLápis de Olhos 24/7 Double-Ended Pencil,Urban Decay,,115,69,cores selecionadasLoção Pré-Maquiagem B6 Vitamin Infused Spray,Urban Decay,,209,115,Lápis de Olhos Contour Eye Pencil,Sephora Collection,,42,29,cores selecionadasBlush Naked Flushed,Urban Decay,,219,169,Corretivo 8HR Wear Perfect Cover Concealer,Sephora Collection,,72,59,Kit Esmalte Mini Nail Paint Fashion Artist's Edition,Sephora Collection,,99,89,Hidratante Labial Super Smoothing Lip Butter,Sephora Collection,,42,37,Pó Bronzeador O!Mega Bronze - Perfect Tan,Marc Jacobs Beauty,,259,199,Kit The System,Formula X,,199,159,Lápis de Olhos Retractable Waterproof Eyeliner,Sephora Collection,,52,39,Batom Rouge Shine Lipstick,Sephora Collection,,45,39,cores selecionadasBatom Color Lip Last,Sephora Collection,,59,39,cores selecionadasBase Lock-It Tattoo Foundation,Kat Von D,,249,179,Removedor de Esmalte DELETE - Nail Polish Remover,Formula X,,89,59,Óleo Fortificante Mavaderma Stimule La Croissance Des Ongles,Mavala,,112,79,Sombra Colorful Eye Shadow Duo Chrome Spring Collection 15,Sephora Collection,,52,39,Ultra Shine Lip Gel Gloss,Sephora Collection,,62,49,Máscara de Cílios Outrageous Volume Mascara,Sephora Collection,,79,59,Base Hidratante Argan Tinted Moisturizer,Josie Maran,,189,179,Lápis de Olhos Long Lasting Kohl Pencil,Sephora Collection,,42,29,cores selecionadasHidratante Colorfix,Mavala,,82,59,Base Hello Flawless Oxygen Wow!,Benefit Cosmetics,,179,179,Anti-Rugas Bio-Performance Advanced Super Restoring Cream,Shiseido,,629,629,Brilho Dior Addict Gloss,Dior,,155,155,Máscara de Cílios Faux Lash Mascara,Laura Mercier,,159,99,Pó Compacto Mineral Pressed Powder SPF 15,Laura Mercier,,229,169,Batom Urban Decay Revolution Lipstick,Urban Decay,,139,99,Fixador Mavadry,Mavala,,119,79,Universal Lip Liner,Sephora Collection,,38,29,Pré-Maquiagem Color Guard Eye Primer,Sephora Collection,,67,49,Demaquilante Waterproof Eye Makeup Remover -125ml ,Sephora Collection,,55,39,Demaquilante Instant Eye Makeup Remover 125ml,Sephora Collection,,53,39,Óleo Hidratante 100% Pure Argan Oil ,Josie Maran,,225,135,Óleo Hidratante 100% Pure Argan Oil -Travel Size,Josie Maran,,85,51,Demaquilante Waterproof Eye Makeup Remover 250ml,Sephora Collection,,32,28,Pré-Maquiagem Nº 28 Primer Serum Hydrating Anti-Aging - Travel Size,Hourglass,,106,69,Nail designer Gel effect,Sephora Collection,,19,14,Oléo Hidratante 100% Pure Argan Oil Light - travel size,Josie Maran,,85,51,Base Tinted Moisturizer Broad Spectrum SPF 20 ,Laura Mercier,,299,229,Corretivo Lock It,Kat Von D,,169,110,LIGHT 16Naked Palette,Urban Decay,,299,239,Corretivo Urban Decay 24/7 ,Urban Decay,,109,89,Base Naked Skin Powder,Urban Decay,,235,205,Fixador De Slick ,Urban Decay,,179,129,Primer Radiance ,Laura Mercier,,199,169,Invisible Pressed Setting Power,Laura Mercier,,209,165,Attimo L'Eau Florale Feminino Eau de Toilette 100ml,Salvatore Ferragamo,,408,299,Bvlgari Man in Black Masculino Eau de Parfum 100 ml,Bvlgari,,500,470,Calvin Klein Beauty Feminino Eau de Parfum 100ml,Calvin Klein,,495,339,Cartier de Lune Feminino Eau de Toilette 45ml,Cartier,,394,329,CK One Summer,Calvin Klein,,275,119,Coffret A Men Masculino Eau de Toilette 100ml,Thierry Mugler,,269,229,Coffret Brit Rhythm Men Masculino Eau de Toilette 50ml,Burberry,,305,249,Coffret Elixir by Shakira Feminino Eau de Toilette II 230ml,Shakira,,149,129,Coffret Love Forever Love Feminino Eau de Toilette 80ml,Agatha Ruiz de La Prada,,119,99,Coffret Shakira Wild Elixir Feminino Eau de Toilette 230ml,Shakira,,149,129,Collezione Barbiere  Revitalizing Face Cream,Acqua Di Parma,,230,189,Daisy Delight Feminino Eau de Toilette 50ml,Marc Jacobs,,299,249,Daisy Eau So Fresh Feminino Eau de Toilette 75 ml,Marc Jacobs,,359,299,Daisy So Fresh Delight Feminino Eau de Toilette 75 ml,Marc Jacobs,,309,259,Daisy So Fresh Sorbet Feminino Eau de Toilette 75 ml,Marc Jacobs,,309,269,Daisy Sorbet Feminino Eau de Toilette 50ml,Marc Jacobs,,299,259,Desodorante Pleats Please Feminino,Issey Miyake,,189,129,Eau de Cartier Concentrée Unissex Eau de Toilette 200ml,Cartier,,599,479,Eau de Parfum Boss Nuit Intense Pour Femme 50ml,Hugo Boss,,422,299,Essence Pure Masculino Eau de Toilette,S.T. Dupont,,169,99,Flora by Gucci Glorious Mandarin Feminino Eau de Toilette 50ml,Gucci,,329,259,Kenzo Homme Sport Extreme Masculino Eau de Toilette 100ml,Kenzo,,349,229,Le Male The Sailor Guy Masculino Eau de Toilette 125ml,Jean Paul Gaultier,,484,399,Le Parfum Resort Collection Feminino Eau de Toilette 50ml,Elie Saab,,359,299,Lola Feminino Eau de Parfum 50ml,Marc Jacobs,,554,329,Michael Kors Feminino Eau de Parfum 100ml,Michael Kors,,479,329,Michael Kors Masculino Eau de Toilette 125ml,Michael Kors,,339,239,Monsieur Masculino Eau de Cologne,Jean Paul Gaultier,,198,99,Moschino Chic Petals Feminino Eau de Toilette,Moschino,,346,269,Nuit D'Issey Masculino  Eau de Toilette,Issey Miyake,,272,199,Passenger Cruiser Feminino Eau de Toilette 50ml,S.T. Dupont,,272,159,Passenger Cruiser Masculino Eau de Toilette 30ml,S.T. Dupont,,179,129,Passenger Pour Femme Feminino Eau de Parfum 30ml,S.T. Dupont,,199,129,Rollerball Sephora Collection Feminino Eau de Toilette 7ml,Sephora Collection,,30,19,cores selecionadasRollerball Someday by Justin Bieber Feminino Eau de Parfum 7ml,Justin Bieber,,99,50,S.T. Dupont Homme Masculino Eau de Toilette 30 ml,S.T. Dupont,,169,69,The Brilliant Game Masculino Eau de Toilette 60ml,Davidoff,,240,199,Tommy Brights Masculino Eau de Toilette 50ml,Tommy Hilfiger,,99,69,Viva la Fleur-Viva la Juicy Rollerball Duo 10ml,Juicy Couture,,99,69,Peony Purse Spray Feminino Eau de Toilette 7ml,Sephora Collection,,30,19,Flora By Gucci Feminino Eau Fraiche 30ml,Gucci,,225,169,Perfume para Carros Rimas ao Vento 50ml,Feito Brasil,,48,35,Perfume para Carros Passo Apaixonado 50ml,Feito Brasil,,48,39,Perfume para Carros Seresta ao Luar,Feito Brasil,,48,35,Diesel Fuel For Life Unlimited Feminino Eau de Parfum 30ml,Diesel,,279,249,Davidoff Champion Energy Masculino Eau de Toilette 90ml,Davidoff,,247,199,Desodorante Valentino Uomo Masculino 150ml,Valentino,,169,129,Coffret Polo Red Masculino Eau de Toilette II 100ml,Ralph Lauren,,349,309,Parisienne Feminino Eau de Parfum 30ml,Yves Saint Laurent,,229,135,Juicy Couture Viva La Juicy Feminino Eau de Parfum 50ml,Juicy Couture,,489,245,Armani Code Luna Feminino Eau de Toilette 50ml,Giorgio Armani,,289,199,Carven Le Parfum Feminino Eau de Parfum 100ml,Carven,,499,249,Viva La Juicy Gold Couture Feminino Eau De Parfum Spray 100ml,Juicy Couture,,489,399,Ferrari Rossa Masculino Eau de Toilette 125ml,Ferrari,,299,229,KENZOHOMME Masculino Eau de Toilette 30ml,Kenzo,,199,84,Trésor Midnight Rose Feminino Eau de Parfum 50ml,Lancôme,,409,339,Opium Vapeurs de Parfum Feminino Eau de Toilette Légère 75ml,Yves Saint Laurent,,423,299,Avant Garde Masculino Eau de Toilette 100ml,Lanvin,,371,179,Pacha Ibiza Hot Energy Masculino Eau de Toilette 100ml,Pacha Ibiza,,99,59,Viva La Juicy Noir Feminino Eau de Parfum 100ml,Juicy Couture,,489,249,Diesel Fuel For Life Masculino Eau de Toilette 30ml,Diesel,,235,189,Parisienne Feminino Eau de Parfum 50ml,Yves Saint Laurent,,299,159,Hilfiger Woman Feminino Eau de Parfum 30ml,Tommy Hilfiger,,159,99,Tommy Hilfiger Eau de Prep Masculino Eau de Toilette 30ml,Tommy Hilfiger,,159,49,Only The Brave Tattoo Masculino Eau de Toilette 200ml,Diesel,,319,279,Body Lotion Idylle Feminino 200ml,Guerlain,,260,99,Catch Me Cacharel For Woman Feminino Eau de Parfum 30ml,Cacharel,,249,150,Pacha Ibiza Wild Sex Masculino Eau de Toilette 100ml,Pacha Ibiza,,99,69,Flower In The Air Feminino Eau de Parfum 30ml,Kenzo,,225,149,Flower In The Air Feminino Eau de Parfum 50ml,Kenzo,,345,289,Flower In The Air Feminino Eau de Parfum 100ml,Kenzo,,479,399,Amor Amor In a Flash Feminino Eau de Toilette 30ml,Cacharel,,189,169,Tommy Brights Feminino Eau de Toilette 50ml,Tommy Hilfiger,,119,89,Be Delicious With Benefits Feminino Eau de Toilette 50ml,DKNY,,179,149,Cool Water Feminino Eau de Toilette 30ml,Davidoff,,156,89,Colônia Masculina Desodorante 150ml,Acqua Di Parma,,122,99,Bvlgari Man Masculino Eau de Toilette 30ml,Bvlgari,,325,189,Juicy Couture Feminino Eau de Parfum 30ml,Juicy Couture,,369,199,Moschino Forever Masculino Eau de Toilette 50ml,Moschino,,319,259,Essence Pure Ocean Feminino Eau de Toilette 30ml,S.T. Dupont,,115,99,Essence Pure Ocean Feminino Eau de Toilette 50ml,S.T. Dupont,,172,139,Essence Pure Ocean Feminino Eau de Toilette 100ml,S.T. Dupont,,227,189,Essence Pure Ocean Masculino Eau de Toilette 30ml,S.T. Dupont,,122,99,Essence Pure Ocean Masculino Eau de Toilette 50ml,S.T. Dupont,,172,139,Essence Pure Ocean Masculino Eau de Toilette 100ml,S.T. Dupont,,227,179,Mademoiselle Ricci Feminino Eau de Parfum 80ml,Nina Ricci,,439,349,Light Blue Living Stromboli Masculino Eau de Toilette 40ml,Dolce&Gabbana,,170,129,Baiser Volé Feminino Eau de Toilette 100ml,Cartier,,736,499,Passenger Cruiser Feminino Eau de Toilette 100ml,S.T. Dupont,,374,229,Passenger Cruiser Masculino Eau de Toilette 100ml,S.T. Dupont,,339,259,Pacha Ibiza Queen Glam Feminino Eau de Toilette 80ml,Pacha Ibiza,,99,79,Polo Red Masculino Eau de Toilette 125ml,Ralph Lauren,,459,329,Christina Aguilera Royal Desire Feminino Eau de Toilette 30ml,Christina Aguilera,,119,89,Miss Dior Blooming Bouquet Feminino Eau de Toilette 100ml,Dior,,519,399,Blue Seduction Cocktail Masculino Eau de Toilette 100ml,Antonio Banderas,,99,79,Eau de Cartier Zeste de Soleil Unissex Eau de Cologne 200ml,Cartier,,768,599,Karl Lagerfeld Masculino Eau de Toilette 30ml,Karl Lagerfeld,,219,159,Ambre Gris Feminino Eau de Parfum 75ml,Balmain,,490,299,Carbone Masculino Eau de Toilette 100ml,Balmain,,480,299,Burberry Brit Rhythm Masculino Desodorante 150ml,Burberry,,107,89,Yardley Daisy Floral hand Nail Cream 75ml,Yardley London,,31,25,L'Eau de Riô Avenida Atlântica Unissex Eau de Toilette 50ml,L'Eau de Riô,,69,49,L'Eau de Riô Ipanema Unissex Eau de Toilette 50ml,L'Eau de Riô,,69,49,L'Eau de Riô Paraty Unissex Eau de Toilette 50ml,L'Eau de Riô,,69,49,L'Eau de Riô Avenida Atlântica Unissex Eau de Toilette 15ml,L'Eau de Riô,,39,29,L'Eau de Riô Jardim Botânico Unissex Eau de Toilette 15ml,L'Eau de Riô,,39,29,L'Eau de Riô Ipanema Unissex Eau de Toilette 15ml,L'Eau de Riô,,39,29,L'Eau de Riô Pedra Bonita Unissex Eau de Toilette 15ml,L'Eau de Riô,,39,29,L'Eau de Riô Paraty Unissex Eau de Toilette 15ml,L'Eau de Riô,,39,29,L'Eau de Riô Avenida Atlântica Unissex Eau de Toilette 10ml,L'Eau de Riô,,25,19,Kit L'Eau de Riô Unissex Eau de Toillete 15ml,L'Eau de Riô,,149,99,Kit L'Eau de Riô Unissex Eau de Toillete 10ml,L'Eau de Riô,,119,99,Rue La Boetie Feminino Eau de Parfum 50ml,Molyneux,,208,149,Femme de Varens Sublime Feminino Eau de Parfum 75ml,Ulric de Varens,,119,89,Jaguar Innovation Masculino Eau de Toilette 100ml,Jaguar,,480,299,Jaguar Innovation Masculino Eau de Toilette 60ml,Jaguar,,400,299,Jaguar Evolution Masculino Eau de Toilette 100ml,Jaguar,,400,299,Cabotine Rosalie Feminino Eau de Toilette 50ml,Grés,,240,159,Cabotine Floralie Feminino Eau de Toilette 50ml,Grés,,240,159,Cabotine Floralie Feminino Eau de Toilette 100ml,Grés,,360,199,Lumière Noire Feminino Eau de Parfum 100ml,Grés,,400,299,Lumière Rose Feminino Eau de Parfum 100ml,Grés,,400,299,Burberry Brit Splash Masculino Eau de Toilette 50ml,Burberry,,418,329,Burberry Brit Splash Masculino Eau de Toilette 90ml,Burberry,,536,399,Guess Girl Belle Feminino Eau de Toilette 100ml,Guess,,219,179,