Nome,volumetria,PrecosQuintal Kit Máscara e Hidratante Clareador ,190 g,R$ 134Quintal Kit Máscara e Hidratante Antissinais ,190 g,R$ 134Quintal Kit Máscara e Hidratante antiacne ,190 g,R$ 134Quintal Kit Máscara e Hidratante regenerador,190 g,R$ 134
Quintal máscara de Argila Branca Clareadora,140 g,R$ 86Quintal Hidratante Finalizador Clareador ,50 g,R$ 68Quintal máscara De Argila Vermelha Antissinais ,140 g,R$ 86Quintal Hidratante Finalizador Antissinais ,50 g,R$ 68Quintal máscara De Argila Verde Antiacne ,140 g,R$ 86Quintal Hidratante Finalizador Antiacne ,50 g,R$ 68Quintal máscara De Argila Preta Regeneradora ,140 g,R$ 86Quintal Hidratante Finalizador Regenerador ,50 g,R$ 68"Gomagem Corporal ""Pura Fantasia""",,R$ 60"Gel De Banho Gelado ""Alegria De Quadrilha""",,R$ 68"Hidratante Corporal De Banho ""Santa Viola""",,R$ 99"Loção Iluminadora Com Efeito Bronzeador ""Lendas Em Toadas""",,R$ 118"Óleo Para Massagem ""Graça Das Águas""",,R$ 78Kit Segredos De Camarim,,R$ 240Espuma De Limpeza Facial Segredos De Camarim ,50 ml,R$ 42Gel Esfoliante Facial Segredos De Camarim,60 g,R$ 44Loção Tônica E Demaquilante Segredos De Camarim ,50 g,R$ 56Máscara Facial De Argila Segredos De Camarim ,140 ml,R$ 78Fluido Hidratante Facial Segredos De Camarim ,50 ml,R$ 56Sabonete Em Barra Coco Casca Prometida ,90 g,R$ 28Sabonete Em Barra Carambola Estrela-Dia ,90 g,R$ 28Sabonete Em Barra Manga Polpa Solar ,90 g,R$ 28Sabonete Em Barra Pitanga Vermelho-Tupi ,90 g,R$ 28Sabonete Em Barra Amora Fruto Da Silva ,90 g,R$ 28Sabonete Em Barra Jabuticaba Frutas Em Botão ,90 g,R$ 28Gel De Ducha Caju E Carambola ,200 ml,R$ 42"Hidratante Corporal Cereja, Amora E Framboesa ",200 ml,R$ 56Spray Hidratante Pernas E Pés Água De Coco E Maçã Verde ,200 ml,R$ 56Gel Esfoliante Facial Creme De Papaia E Damasco ,180 g,R$ 59Hidratante Corporal Perfumado Para Bem Estar ,200 g,R$ 65Hidratante Corporal Peles Expostas Ao Verão ,200 g,R$ 65Hidratante Corporal Perfumado - Peles Delicadas ,200 g,R$ 65Polpa Hidratante Para As Mãos Sessão Romance ,150 ml,R$ 53Mousse Hidratante Corporal Sessão Romance ,150 ml,R$ 56Espuma De Banho Líquida Sessão Romance ,380 ml,R$ 59Vela Perfumada Para Massagem Sessão Romance ,80 g,R$ 39Bomba Efervescente Sessão Romance ,100 g,R$ 28